[
  {
    "status": "needs_input",
    "draft": {
      "schema_version": "1.0",
      "work_item_id": "ACCORD-1234",
      "spec": "docs/dev/ACCORD-1234/spec.json",
      "guidance": [],
      "reuse_candidates": [
        { "symbol": "AuthService", "file": "src/services/auth.ts", "fit": "extend" }
      ]
    },
    "questions": [
      { "id": "q_guidance_1", "stage": "engineer_guidance", "text": "Should the refresh endpoint delegate to AuthService.refresh(), or a new dedicated RefreshService?" },
      { "id": "q_guidance_2", "stage": "engineer_guidance", "text": "Any files, modules, or patterns to use or avoid?" }
    ],
    "usage": { "prompt_tokens": 7800, "completion_tokens": 1100 }
  },
  {
    "status": "done",
    "plan_path": "docs/dev/ACCORD-1234/plan.json",
    "review_findings_remaining": 0,
    "usage": { "prompt_tokens": 14200, "completion_tokens": 2400 }
  }
]
